title,doi,file_location
Solving Immunology?,10.1016/j.it.2016.11.006,data/MS_EXPORT/files/22158/Vodovotz et al. - 2017 - Solving Immunology.pdf
Immune Ageing at Single-Cell Resolution,10.1038/s41577-021-00646-4,data/MS_EXPORT/files/22178/Mogilenko et al. - 2022 - Immune ageing at single-cell resolution.pdf
Tissue-Resident Immune Cells in Humans,10.1146/annurev-immunol-093019-112809,data/MS_EXPORT/files/22180/Gray and Farber - 2022 - Tissue-Resident Immune Cells in Humans.pdf
Functional Hallmarks of Healthy Macrophage Responses: Their Regulatory Basis and Disease Relevance,10.1146/annurev-immunol-101320-031555,data/MS_EXPORT/files/22181/Sheu and Hoffmann - 2022 - Functional Hallmarks of Healthy Macrophage Responses Their Regulatory Basis and Disease Relevance.pdf
Gene Regulatory Circuits in Innate and Adaptive Immune Cells,10.1146/annurev-immunol-101320-025949,data/MS_EXPORT/files/22182/Saini et al. - 2022 - Gene Regulatory Circuits in Innate and Adaptive Immune Cells.pdf
Control of RelB during Dendritic Cell Activation Integrates Canonical and Noncanonical NF-{$\kappa$}B Pathways,10.1038/ni.2446,data/MS_EXPORT/files/22186/Shih et al. - 2012 - Control of RelB during dendritic cell activation integrates canonical and noncanonical NF-κB pathway.pdf
Listening in on Multicellular Communication in Human Tissue Immunology,10.3389/fimmu.2022.884185,data/MS_EXPORT/files/22187/Albers and Pelka - 2022 - Listening in on Multicellular Communication in Human Tissue Immunology.pdf
The Science and Medicine of Human Immunology,10.1126/science.aay4014,data/MS_EXPORT/files/22219/Pulendran and Davis - 2020 - The science and medicine of human immunology.pdf
Recording the Wild Lives of Immune Cells,10.1126/sciimmunol.aaq0491,data/MS_EXPORT/files/22224/Pittet et al. - 2018 - Recording the wild lives of immune cells.pdf
SREBP Signaling Is Essential for Effective B Cell Responses,10.1038/s41590-022-01376-y,data/MS_EXPORT/files/22246/Luo et al. - 2023 - SREBP signaling is essential for effective B cell responses.pdf
Systems Biology of Vaccination for Seasonal Influenza in Humans,10.1038/ni.2067,data/MS_EXPORT/files/22254/Nakaya et al. - 2011 - Systems biology of vaccination for seasonal influenza in humans.pdf
ImmuneData: An Integrated Data Discovery System for Immunology Data Repositories,10.1093/database/baac003,data/MS_EXPORT/files/22271/Deng et al. - 2022 - ImmuneData an integrated data discovery system for immunology data repositories.pdf
"Systems Immunology: A Survey of Modeling Formalisms, Applications and Simulation Tools",10.1007/s12026-012-8305-7,"data/MS_EXPORT/files/22281/Narang et al. - 2012 - Systems immunology a survey of modeling formalisms, applications and simulation tools.pdf"
What Scales the T Cell Response?,10.1016/j.it.2016.06.005,data/MS_EXPORT/files/22282/Mayya and Dustin - 2016 - What Scales the T Cell Response.pdf
Systems Biology in Immunology: A Computational Modeling Perspective,10.1146/annurev-immunol-030409-101317,data/MS_EXPORT/files/22284/Germain et al. - 2011 - Systems Biology in Immunology A Computational Modeling Perspective.pdf
Systems Vaccinology and Big Data in the Vaccine Development Chain,10.1111/imm.13012,data/MS_EXPORT/files/22295/Raeven et al. - 2019 - Systems vaccinology and big data in the vaccine development chain.pdf
Variability in the Immune System: Of Vaccine Responses and Immune States,10.1016/j.coi.2013.07.009,data/MS_EXPORT/files/22296/Shen-Orr and Furman - 2013 - Variability in the immune system of vaccine responses and immune states.pdf
CD4+ T Cell Memory,10.1038/s41590-023-01510-4,data/MS_EXPORT/files/22305/Künzli and Masopust - 2023 - CD4+ T cell memory.pdf
"The Immune Signatures Data Resource, a Compendium of Systems Vaccinology Datasets",10.1038/s41597-022-01714-7,"data/MS_EXPORT/files/22314/Diray-Arce et al. - 2022 - The Immune Signatures data resource, a compendium of systems vaccinology datasets.pdf"
Single-Cell Multiomic Analysis of Thymocyte Development Reveals Drivers of CD4+ T Cell and CD8+ T Cell Lineage Commitment,10.1038/s41590-023-01584-0,data/MS_EXPORT/files/22321/Steier et al. - 2023 - Single-cell multiomic analysis of thymocyte development reveals drivers of CD4+ T cell and CD8+ T ce.pdf
Doubling down to Make Killer T Cells,10.1038/s41590-023-01593-z,data/MS_EXPORT/files/22322/Kappes and Wiest - 2023 - Doubling down to make killer T cells.pdf
Single-Cell Diversity and Functional Plasticity of Human MAIT Cells,10.1038/s41590-023-01600-3,data/MS_EXPORT/files/22323/2023 - Single-cell diversity and functional plasticity of human MAIT cells.pdf
"Single-Cell Analysis of Human MAIT Cell Transcriptional, Functional and Clonal Diversity",10.1038/s41590-023-01575-1,"data/MS_EXPORT/files/22324/Garner et al. - 2023 - Single-cell analysis of human MAIT cell transcriptional, functional and clonal diversity.pdf"
Trimodal Single-Cell Profiling Reveals a Novel Pediatric CD8{$\alpha\alpha$}+ T Cell Subset and Broad Age-Related Molecular Reprogramming across the T Cell Compartment,10.1038/s41590-023-01641-8,data/MS_EXPORT/files/22325/Thomson et al. - 2023 - Trimodal single-cell profiling reveals a novel pediatric CD8αα+ T cell subset and broad age-related.pdf
"Tissue-Resident Memory CD8+ T Cells Possess Unique Transcriptional, Epigenetic and Functional Adaptations to Different Tissue Environments",10.1038/s41590-022-01229-8,"data/MS_EXPORT/files/22326/Crowl et al. - 2022 - Tissue-resident memory CD8+ T cells possess unique transcriptional, epigenetic and functional adapta.pdf"
Simulation Modelling for Immunologists,10.1038/s41577-019-0235-3,data/MS_EXPORT/files/22341/Handel et al. - 2020 - Simulation modelling for immunologists.pdf
Dendritic Cell Subsets in Cancer Immunity and Tumor Antigen Sensing,10.1038/s41423-023-00990-6,data/MS_EXPORT/files/22356/Del Prete et al. - 2023 - Dendritic cell subsets in cancer immunity and tumor antigen sensing.pdf
Tissue Adaptation and Clonal Segregation of Human Memory T Cells in Barrier Sites,10.1038/s41590-022-01395-9,data/MS_EXPORT/files/22357/Poon et al. - 2023 - Tissue adaptation and clonal segregation of human memory T cells in barrier sites.pdf
"Dissecting the Dynamic Transcriptional Landscape of Early T Helper Cell Differentiation into Th1, Th2, and Th1/2 Hybrid Cells",10.3389/fimmu.2022.928018,"data/MS_EXPORT/files/22387/Burt et al. - 2022 - Dissecting the dynamic transcriptional landscape of early T helper cell differentiation into Th1, Th.pdf"
Secondary Mechanisms of Diversification in the Human Antibody Repertoire,10.3389/fimmu.2013.00042,data/MS_EXPORT/files/22396/Briney and Jr. - 2013 - Secondary mechanisms of diversification in the human antibody repertoire.pdf
Epigenetic Aspects of Lymphocyte Antigen Receptor Gene Rearrangement or `When Stochasticity Completes Randomness',10.1111/imm.12057,data/MS_EXPORT/files/22432/Jaeger et al. - 2013 - Epigenetic aspects of lymphocyte antigen receptor gene rearrangement or ‘when stochasticity complete.pdf
Central Tolerance: Learning Self-Control in the Thymus,10.1038/nri1707,data/MS_EXPORT/files/22435/Hogquist et al. - 2005 - Central tolerance learning self-control in the thymus.pdf
Systems Approaches to Human Autoimmune Diseases,10.1016/j.coi.2013.08.005,data/MS_EXPORT/files/22469/Banchereau et al. - 2013 - Systems approaches to human autoimmune diseases.pdf
The Role of the Gut Microbiota in Multiple Sclerosis,10.1038/s41582-022-00697-8,data/MS_EXPORT/files/22542/Correale et al. - 2022 - The role of the gut microbiota in multiple sclerosis.pdf
Epstein--Barr Virus as a Leading Cause of Multiple Sclerosis: Mechanisms and Implications,10.1038/s41582-023-00775-5,data/MS_EXPORT/files/22552/Bjornevik et al. - 2023 - Epstein–Barr virus as a leading cause of multiple sclerosis mechanisms and implications.pdf
Epstein--Barr Virus and Multiple Sclerosis,10.1038/s41579-022-00770-5,data/MS_EXPORT/files/22553/Soldan and Lieberman - 2023 - Epstein–Barr virus and multiple sclerosis.pdf
Drivers of Heterogeneity in Synovial Fibroblasts in Rheumatoid Arthritis,10.1038/s41590-023-01527-9,data/MS_EXPORT/files/22554/Smith et al. - 2023 - Drivers of heterogeneity in synovial fibroblasts in rheumatoid arthritis.pdf
Human Disease-Specific Cell Signatures in Non-Lesional Tissue in Multiple Sclerosis Detected by Single-Cell and Spatial Transcriptomics,10.1101/2023.12.20.572491,data/MS_EXPORT/files/22582/Lam et al. - 2023 - Human disease-specific cell signatures in non-lesional tissue in Multiple Sclerosis detected by sing.pdf
Identifying CNS-Colonizing T Cells as Potential Therapeutic Targets to Prevent Progression of Multiple Sclerosis,10.1016/j.medj.2021.01.006,data/MS_EXPORT/files/22583/Kaufmann et al. - 2021 - Identifying CNS-colonizing T cells as potential therapeutic targets to prevent progression of multip.pdf
The Sense of Place in the Immune System,10.1038/ni0406-329,data/MS_EXPORT/files/22631/Cahalan and Gutman - 2006 - The sense of place in the immune system.pdf
Integrating Single-Cell Multi-Omics and Prior Biological Knowledge for a Functional Characterization of the Immune System,10.1038/s41590-024-01768-2,data/MS_EXPORT/files/22751/Schäfer et al. - 2024 - Integrating single-cell multi-omics and prior biological knowledge for a functional characterization.pdf
The Compartmentalized Inflammatory Response in the Multiple Sclerosis Brain Is Composed of Tissue-Resident CD8+ T Lymphocytes and B Cells,10.1093/brain/awy151,data/MS_EXPORT/files/22752/Machado-Santos et al. - 2018 - The compartmentalized inflammatory response in the multiple sclerosis brain is composed of tissue-re.pdf
Slow Expansion of Multiple Sclerosis Iron Rim Lesions: Pathology and 7 T Magnetic Resonance Imaging,10.1007/s00401-016-1636-z,data/MS_EXPORT/files/22753/Dal-Bianco et al. - 2017 - Slow expansion of multiple sclerosis iron rim lesions pathology and 7 T magnetic resonance imaging.pdf
Spatial Distribution of Multiple Sclerosis Iron Rim Lesions and Their Impact on Disability,10.1016/j.msard.2022.103967,data/MS_EXPORT/files/22755/Wittayer et al. - 2022 - Spatial distribution of multiple sclerosis iron rim lesions and their impact on disability.pdf
Homogeneity of Active Demyelinating Lesions in Established Multiple Sclerosis,10.1002/ana.21311,data/MS_EXPORT/files/22756/Breij et al. - 2008 - Homogeneity of active demyelinating lesions in established multiple sclerosis.pdf
Association of Chronic Active Multiple Sclerosis Lesions With Disability In Vivo,10.1001/jamaneurol.2019.2399,data/MS_EXPORT/files/22757/Absinta et al. - 2019 - Association of Chronic Active Multiple Sclerosis Lesions With Disability In Vivo.pdf
Multiple Sclerosis: Distribution of Inflammatory Cells in Newly Forming Lesions,10.1002/ana.21800,data/MS_EXPORT/files/22758/Henderson et al. - 2009 - Multiple sclerosis Distribution of inflammatory cells in newly forming lesions.pdf
Monocyte/Macrophage Differentiation in Early Multiple Sclerosis Lesions,10.1002/ana.410380514,data/MS_EXPORT/files/22759/Brück et al. - 1995 - Monocytemacrophage differentiation in early multiple sclerosis lesions.pdf
Cortical Projection Neurons as a Therapeutic Target in Multiple Sclerosis,10.1080/14728222.2020.1842358,data/MS_EXPORT/files/22760/Beutel et al. - 2020 - Cortical projection neurons as a therapeutic target in multiple sclerosis.pdf
Cross-Regional Homeostatic and Reactive Glial Signatures in Multiple Sclerosis,10.1007/s00401-022-02497-2,data/MS_EXPORT/files/22761/Trobisch et al. - 2022 - Cross-regional homeostatic and reactive glial signatures in multiple sclerosis.pdf
Myeloid Cell Iron Uptake Pathways and Paramagnetic Rim Formation in Multiple Sclerosis,10.1007/s00401-023-02627-4,data/MS_EXPORT/files/22762/Hofmann et al. - 2023 - Myeloid cell iron uptake pathways and paramagnetic rim formation in multiple sclerosis.pdf
Single-Cell Multi-Omics Map of Cell Type--Specific Mechanistic Drivers of Multiple Sclerosis Lesions,10.1212/NXI.0000000000200213,data/MS_EXPORT/files/22763/Elkjaer et al. - 2024 - Single-Cell Multi-Omics Map of Cell Type–Specific Mechanistic Drivers of Multiple Sclerosis Lesions.pdf
Disease Models of Autoimmunity,10.1016/j.it.2005.09.003,data/MS_EXPORT/files/22776/Ferguson - 2005 - Disease models of autoimmunity.pdf
Molecular Mechanisms Linking Neuroinflammation and Neurodegeneration in MS,10.1016/j.expneurol.2014.02.006,data/MS_EXPORT/files/22777/Ellwardt and Zipp - 2014 - Molecular mechanisms linking neuroinflammation and neurodegeneration in MS.pdf
Animal Models for Autoimmune and Inflammatory Disease,10.1002/0471142735.im1500s96,data/MS_EXPORT/files/22778/Shevach - 2012 - Animal Models for Autoimmune and Inflammatory Disease.pdf
Experimental Autoimmune Encephalomyelitis in the Mouse,10.1002/0471142735.im1501s88,data/MS_EXPORT/files/22779/Miller et al. - 2010 - Experimental Autoimmune Encephalomyelitis in the Mouse.pdf
Experimental Autoimmune Encephalomyelitis in the Rat,10.1002/0471142735.im1502s85,data/MS_EXPORT/files/22780/Mannie et al. - 2009 - Experimental Autoimmune Encephalomyelitis in the Rat.pdf
Spatial Transcriptomics and Neurofilament Light Chain Reveal Changes in Lesion Patterns in Murine Autoimmune Neuroinflammation,10.1186/s12974-023-02947-y,data/MS_EXPORT/files/22782/Brummer et al. - 2023 - Spatial transcriptomics and neurofilament light chain reveal changes in lesion patterns in murine au.pdf
Cell Type-Specific Transcriptomics Identifies Neddylation as a Novel Therapeutic Target in Multiple Sclerosis,10.1093/brain/awaa421,data/MS_EXPORT/files/22786/Kim et al. - 2021 - Cell type-specific transcriptomics identifies neddylation as a novel therapeutic target in multiple.pdf
Democratizing Systems Immunology with Modular Transcriptional Repertoire Analyses,10.1038/nri3642,data/MS_EXPORT/files/22791/Chaussabel and Baldwin - 2014 - Democratizing systems immunology with modular transcriptional repertoire analyses.pdf
Resident Tissue Macrophages: Key Coordinators of Tissue Homeostasis beyond Immunity,10.1126/sciimmunol.add1967,data/MS_EXPORT/files/22815/Zhao et al. - 2024 - Resident tissue macrophages Key coordinators of tissue homeostasis beyond immunity.pdf
Could Mathematics Be the Key to Unlocking the Mysteries of Multiple Sclerosis?,10.1007/s11538-023-01181-0,data/MS_EXPORT/files/22835/Weatherley et al. - 2023 - Could Mathematics be the Key to Unlocking the Mysteries of Multiple Sclerosis.pdf
Exploring New Perspectives in Immunology,10.1016/j.cell.2024.03.038,data/MS_EXPORT/files/22837/Medzhitov and Iwasaki - 2024 - Exploring new perspectives in immunology.pdf
"Of Mice, Men and Immunity: A Case for Evolutionary Systems Biology",10.1038/s41590-018-0084-4,"data/MS_EXPORT/files/22844/Ernst and Carvunis - 2018 - Of mice, men and immunity a case for evolutionary systems biology.pdf"
Biochemical Biomarkers for Multiple Sclerosis,10.1016/j.cca.2023.117471,data/MS_EXPORT/files/22853/Maroto-García et al. - 2023 - Biochemical biomarkers for multiple sclerosis.pdf
A Method for Predicting Drugs That Can Boost the Efficacy of Immune Checkpoint Blockade,10.1038/s41590-024-01789-x,data/MS_EXPORT/files/22859/Xia et al. - 2024 - A method for predicting drugs that can boost the efficacy of immune checkpoint blockade.pdf
Role of Tumor Necrosis Factor-Alpha in the Central Nervous System: A Focus on Autoimmune Disorders,10.3389/fimmu.2023.1213448,data/MS_EXPORT/files/22965/Gonzalez Caldito - 2023 - Role of tumor necrosis factor-alpha in the central nervous system a focus on autoimmune disorders.pdf
Twin Study Dissects CXCR3+ Memory B Cells as Non-Heritable Feature in Multiple Sclerosis,10.1016/j.medj.2024.02.013,data/MS_EXPORT/files/22971/Ingelfinger et al. - 2024 - Twin study dissects CXCR3+ memory B cells as non-heritable feature in multiple sclerosis.pdf
"A Humanized Mouse That Mounts Mature Class-Switched, Hypermutated and Neutralizing Antibody Responses",10.1038/s41590-024-01880-3,"data/MS_EXPORT/files/23039/Chupp et al. - 2024 - A humanized mouse that mounts mature class-switched, hypermutated and neutralizing antibody response.pdf"
Angiotensin II Controls Occludin Function and Is Required for Blood--Brain Barrier Maintenance: Relevance to Multiple Sclerosis,10.1523/JNEUROSCI.2088-07.2007,data/MS_EXPORT/files/23070/Wosik et al. - 2007 - Angiotensin II Controls Occludin Function and Is Required for Blood–Brain Barrier Maintenance Relev.pdf
Endothelial-to-Mesenchymal Transition in Multiple Sclerosis: Good Cells Gone Bad,10.1016/j.neuron.2022.09.017,data/MS_EXPORT/files/23072/Mey and DeSilva - 2022 - Endothelial-to-mesenchymal transition in multiple sclerosis Good cells gone bad.pdf
CD19-Targeted Chimeric Antigen Receptor T Cell Therapy in Two Patients with Multiple Sclerosis,10.1016/j.medj.2024.03.002,data/MS_EXPORT/files/23075/Fischbach et al. - 2024 - CD19-targeted chimeric antigen receptor T cell therapy in two patients with multiple sclerosis.pdf
TGF-Beta1 Regulates Human Brain Pericyte Inflammatory Processes Involved in Neurovasculature Function,10.1186/s12974-016-0503-0,data/MS_EXPORT/files/23076/Rustenhoven et al. - 2016 - TGF-beta1 regulates human brain pericyte inflammatory processes involved in neurovasculature functio.pdf
A Guide to Vaccinology: From Basic Principles to New Developments,10.1038/s41577-020-00479-7,data/MS_EXPORT/files/23086/Pollard and Bijker - 2021 - A guide to vaccinology from basic principles to new developments.pdf
Trogocytosis Challenges the Cellular Specificity of Lineage Markers and Monoclonal Antibodies,10.1038/s41577-023-00920-7,data/MS_EXPORT/files/23107/Ochs et al. - 2023 - Trogocytosis challenges the cellular specificity of lineage markers and monoclonal antibodies.pdf
A Milestone in Multiple Sclerosis Therapy: Monoclonal Antibodies Against CD20---Yet Progress Continues,10.1007/s13311-021-01048-z,data/MS_EXPORT/files/23108/Frisch et al. - 2021 - A Milestone in Multiple Sclerosis Therapy Monoclonal Antibodies Against CD20—Yet Progress Continues.pdf
What Is Trogocytosis and What Is Its Purpose?,10.1038/ni0903-815,data/MS_EXPORT/files/23109/Joly and Hudrisier - 2003 - What is trogocytosis and what is its purpose.pdf
Metabolomics of Multiple Sclerosis Lesions Demonstrates Lipid Changes Linked to Alterations in Transcriptomics-Based Cellular Profiles,10.1212/NXI.0000000000200219,data/MS_EXPORT/files/23123/Ladakis et al. - 2024 - Metabolomics of Multiple Sclerosis Lesions Demonstrates Lipid Changes Linked to Alterations in Trans.pdf
T-cell Activation--Induced Marker Assays in Health and Disease,10.1111/imcb.12636,data/MS_EXPORT/files/23125/Poloni et al. - 2023 - T‐cell activation–induced marker assays in health and disease.pdf
Transcriptional Atlas of the Human Immune Response to 13 Vaccines Reveals a Common Predictor of Vaccine-Induced Antibody Responses,10.1038/s41590-022-01328-6,data/MS_EXPORT/files/23128/Hagan et al. - 2022 - Transcriptional atlas of the human immune response to 13 vaccines reveals a common predictor of vacc.pdf
CCL Genes in Multiple Sclerosis and Systemic Lupus Erythematosus,10.1016/j.jneuroim.2008.05.016,data/MS_EXPORT/files/23148/Vyshkina et al. - 2008 - CCL genes in multiple sclerosis and systemic lupus erythematosus.pdf
Iron Scavenging and Myeloid Cell Polarization,10.1016/j.it.2024.06.006,data/MS_EXPORT/files/23156/Ludwig et al. - 2024 - Iron scavenging and myeloid cell polarization.pdf
Mitochondrial Complex I Activity in Microglia Sustains Neuroinflammation,10.1038/s41586-024-07167-9,data/MS_EXPORT/files/10198/Peruzzotti-Jametti et al. - 2024 - Mitochondrial complex I activity in microglia sust.pdf
Brain Macrophages Acquire Distinct Transcriptomes in Multiple Sclerosis Lesions and Normal Appearing White Matter,10.1186/s40478-021-01306-3,data/MS_EXPORT/files/23167/Miedema et al. - 2022 - Brain macrophages acquire distinct transcriptomes in multiple sclerosis lesions and normal appearing.pdf
Single-Cell Profiling Identifies Myeloid Cell Subsets with Distinct Fates during Neuroinflammation,10.1126/science.aat7554,data/MS_EXPORT/files/23168/Jordão et al. - 2019 - Single-cell profiling identifies myeloid cell subsets with distinct fates during neuroinflammation.pdf
Persistent 7-Tesla Phase Rim Predicts Poor Outcome in New Multiple Sclerosis Patient Lesions,10.1172/JCI86198,data/MS_EXPORT/files/23169/Absinta et al. - 2016 - Persistent 7-tesla phase rim predicts poor outcome in new multiple sclerosis patient lesions.pdf
Epigenetic Regulation of Innate Immune Memory in Microglia,10.1186/s12974-022-02463-5,data/MS_EXPORT/files/23170/Zhang et al. - 2022 - Epigenetic regulation of innate immune memory in microglia.pdf
Exposure of iPSC-Derived Human Microglia to Brain Substrates Enables the Generation and Manipulation of Diverse Transcriptional States in Vitro,10.1038/s41590-023-01558-2,data/MS_EXPORT/files/23173/Dolan et al. - 2023 - Exposure of iPSC-derived human microglia to brain substrates enables the generation and manipulation.pdf
Intravenous Immunoglobulins for Multiple Sclerosis,10.1002/14651858.CD002936,data/MS_EXPORT/files/23188/Gray et al. - 2003 - Intravenous immunoglobulins for multiple sclerosis.pdf
Dimethyl Fumarate for Multiple Sclerosis,10.1002/14651858.CD011076.pub2,data/MS_EXPORT/files/23350/Xu et al. - 2015 - Dimethyl fumarate for multiple sclerosis.pdf
Identifying Shared Genetic Loci and Common Risk Genes of Rheumatoid Arthritis Associated with Three Autoimmune Diseases Based on Large-Scale Cross-Trait Genome-Wide Association Studies,10.3389/fimmu.2023.1160397,data/MS_EXPORT/files/23351/Wen and Yu - 2023 - Identifying shared genetic loci and common risk genes of rheumatoid arthritis associated with three.pdf
Treatment Effects of Immunomodulatory Therapies at Different Stages of Multiple Sclerosis in Short-Term Trials,10.1212/WNL.0b013e3182050388,data/MS_EXPORT/files/23356/Bates - 2011 - Treatment effects of immunomodulatory therapies at different stages of multiple sclerosis in short-t.pdf
Molecular Mimicry in MS,10.1038/s41590-022-01156-8,data/MS_EXPORT/files/23357/Dempsey - 2022 - Molecular mimicry in MS.pdf
Epstein-Barr Virus and Multiple Sclerosis,10.1126/science.abm7930,data/MS_EXPORT/files/23358/Robinson and Steinman - Epstein-Barr virus and multiple sclerosis.pdf
Interleukin-6 Deficiency Exacerbates Huntington's Disease Model Phenotypes,10.1186/s13024-020-00379-3,data/MS_EXPORT/files/23406/Wertz et al. - 2020 - Interleukin-6 deficiency exacerbates Huntington’s disease model phenotypes.pdf
B Cell Depletion Attenuates CD27 Signaling of T Helper Cells in Multiple Sclerosis,10.1016/j.xcrm.2023.101351,data/MS_EXPORT/files/23454/Ulutekin et al. - 2024 - B cell depletion attenuates CD27 signaling of T helper cells in multiple sclerosis.pdf
"Repeated Subcutaneous Injections of IL12/23 P40 Neutralising Antibody, Ustekinumab, in Patients with Relapsing-Remitting Multiple Sclerosis: A Phase II, Double-Blind, Placebo-Controlled, Randomised, Dose-Ranging Study",10.1016/S1474-4422(08)70173-X,"data/MS_EXPORT/files/20628/Segal et al. - 2008 - Repeated subcutaneous injections of IL1223 p40 neutralising antibody, ustekinumab, in patients with.pdf"
Heterogeneity of Multiple Sclerosis Lesions: Implications for the Pathogenesis of Demyelination,10.1002/1531-8249(200006)47:6<707::AID-ANA3>3.0.CO;2-Q,data/MS_EXPORT/files/22754/Lucchinetti et al. - 2000 - Heterogeneity of multiple sclerosis lesions Implications for the pathogenesis of demyelination.pdf
Cellular Architecture of Evolving Neuroinflammatory Lesions and Multiple Sclerosis Pathology,10.1016/j.cell.2024.02.030,data/MS_EXPORT/files/22775/Kukanja et al. - 2024 - Cellular architecture of evolving neuroinflammatory lesions and multiple sclerosis pathology.pdf
Predictive Potential of Serum and Cerebrospinal Fluid Biomarkers for Disease Activity in Treated Multiple Sclerosis Patients,10.1016/j.msard.2024.105734,data/MS_EXPORT/files/27191/Tortosa-Carreres et al. - 2024 - Predictive potential of serum and cerebrospinal fluid biomarkers for disease activity in treated mul.pdf
Bruton Tyrosine Kinase Inhibitors for Multiple Sclerosis,10.1038/s41582-023-00800-7,data/MS_EXPORT/files/27200/Krämer et al. - 2023 - Bruton tyrosine kinase inhibitors for multiple sclerosis.pdf
Inflammation and Immune Dysfunction in Parkinson Disease,10.1038/s41577-022-00684-6,data/MS_EXPORT/files/27553/Tansey et al. - 2022 - Inflammation and immune dysfunction in Parkinson disease.pdf
Single Nuclei RNAseq Stratifies Multiple Sclerosis Patients into Distinct White Matter Glial Responses,10.1101/2022.04.06.487263,data/MS_EXPORT/files/27893/Macnair et al. - 2023 - Single nuclei RNAseq stratifies multiple sclerosis patients into distinct white matter glial respons.pdf
Smouldering Multiple Sclerosis: The `Real MS',10.1177/17562864211066751,data/MS_EXPORT/files/27944/Giovannoni et al. - 2022 - Smouldering multiple sclerosis the ‘real MS’.pdf
An Overall View of the Most Common Experimental Models for Multiple Sclerosis,10.1016/j.nbd.2023.106230,data/MS_EXPORT/files/27950/Dedoni et al. - 2023 - An overall view of the most common experimental models for multiple sclerosis.pdf
Quality of Life in Adults with Multiple Sclerosis: A Systematic Review,10.1136/bmjopen-2020-041249,data/MS_EXPORT/files/27947/Gil-González et al. - 2020 - Quality of life in adults with multiple sclerosis a systematic review.pdf
Multiple Sclerosis,10.1038/s41572-018-0041-4,data/MS_EXPORT/files/27954/Filippi et al. - 2018 - Multiple sclerosis.pdf
Fluid Biomarkers in Multiple Sclerosis: From Current to Future Applications,10.1016/j.lanepe.2024.101009,data/MS_EXPORT/files/27953/Filippo et al. - 2024 - Fluid biomarkers in multiple sclerosis from current to future applications.pdf
Multiple Sclerosis - Remyelination Failure as a Cause of Disease Progression,10.14670/HH-27.277,data/MS_EXPORT/files/27960/Hagemeier et al. - 2012 - Multiple sclerosis - remyelination failure as a cause of disease progression.pdf
