title,doi,file_location
Secreted Immune Metabolites That Mediate Immune Cell Communication and Function,10.1016/j.it.2022.10.006,data/MS_EXPORT/files/27978/Zhang et al. - 2022 - Secreted immune metabolites that mediate immune cell communication and function.pdf
NF-{$\kappa$}B Dynamics in the Language of Immune Cells,10.1016/j.it.2022.11.005,data/MS_EXPORT/files/27981/Aqdas and Sung - 2023 - NF-κB dynamics in the language of immune cells.pdf
TCR Sequencing Paired with Massively Parallel 3{$\prime$} RNA-Seq Reveals Clonotypic T Cell Signatures,10.1038/s41590-019-0544-5,data/MS_EXPORT/files/27983/Tu et al. - 2019 - TCR sequencing paired with massively parallel 3′ RNA-seq reveals clonotypic T cell signatures.pdf
The Immunoregulatory Landscape of Human Tuberculosis Granulomas,10.1038/s41590-021-01121-x,data/MS_EXPORT/files/27990/McCaffrey et al. - 2022 - The immunoregulatory landscape of human tuberculosis granulomas.pdf
Hematopoiesis in Numbers,10.1016/j.it.2021.10.006,data/MS_EXPORT/files/27993/Cosgrove et al. - 2021 - Hematopoiesis in numbers.pdf
{$A\beta$} T Cell Receptors as Predictors of Health and Disease,10.1038/cmi.2014.134,data/MS_EXPORT/files/27995/Attaf et al. - 2015 - αβ T cell receptors as predictors of health and disease.pdf
Dual TCR T Cells: Identity Crisis or Multitaskers?,10.4049/jimmunol.1800904,data/MS_EXPORT/files/28143/Schuldt and Binstadt - 2019 - Dual TCR T Cells Identity Crisis or Multitaskers.pdf
Interpretable Neural ODEs for Gene Regulatory Network Discovery under Perturbations,10.48550/arXiv.2501.02409,data/MS_EXPORT/files/28151/Lin et al. - 2025 - Interpretable Neural ODEs for Gene Regulatory Network Discovery under Perturbations.pdf
Single-Cell Multiomics Defines Tolerogenic Extrathymic Aire-Expressing Populations with Unique Homology to Thymic Epithelium,10.1126/sciimmunol.abl5053,data/MS_EXPORT/files/28168/Wang et al. - 2021 - Single-cell multiomics defines tolerogenic extrathymic Aire-expressing populations with unique homol.pdf
Predicting RNA-Seq Coverage from DNA Sequence as a Unifying Model of Gene Regulation,10.1101/2023.08.30.555582,data/MS_EXPORT/files/23223/Linder et al. - 2023 - Predicting RNA-seq coverage from DNA sequence as a unifying model of gene regulation.pdf
Neuronal Vulnerability and Multilineage Diversity in Multiple Sclerosis,10.1038/s41586-019-1404-z,data/MS_EXPORT/files/28346/Schirmer et al. - 2019 - Neuronal vulnerability and multilineage diversity in multiple sclerosis.pdf
Identification of Early Neurodegenerative Pathways in Progressive Multiple Sclerosis,10.1038/s41593-022-01097-3,data/MS_EXPORT/files/28348/Kaufmann et al. - 2022 - Identification of early neurodegenerative pathways in progressive multiple sclerosis.pdf
A Pathogenic and Clonally Expanded B Cell Transcriptome in Active Multiple Sclerosis,10.1073/pnas.2008523117,data/MS_EXPORT/files/28350/Ramesh et al. - 2020 - A pathogenic and clonally expanded B cell transcriptome in active multiple sclerosis.pdf
Single-Cell RNA-Seq Analysis of Human CSF Microglia and Myeloid Cells in Neuroinflammation,10.1212/NXI.0000000000000732,data/MS_EXPORT/files/28352/Esaulova et al. - 2020 - Single-cell RNA-seq analysis of human CSF microglia and myeloid cells in neuroinflammation.pdf
Integrated Single Cell Analysis of Blood and Cerebrospinal Fluid Leukocytes in Multiple Sclerosis,10.1038/s41467-019-14118-w,data/MS_EXPORT/files/28354/Schafflick et al. - 2020 - Integrated single cell analysis of blood and cerebrospinal fluid leukocytes in multiple sclerosis.pdf
Early Adaptive Immune Activation Detected in Monozygotic Twins with Prodromal Multiple Sclerosis,10.1172/JCI128475,data/MS_EXPORT/files/28356/Beltrán et al. - 2019 - Early adaptive immune activation detected in monozygotic twins with prodromal multiple sclerosis.pdf
Multiple Sclerosis: Emerging Epidemiological Trends and Redefining the Clinical Course,10.1016/j.lanepe.2024.100977,data/MS_EXPORT/files/28371/Portaccio et al. - 2024 - Multiple sclerosis emerging epidemiological trends and redefining the clinical course.pdf
"Rising Prevalence of Multiple Sclerosis Worldwide: Insights from the Atlas of MS, Third Edition",10.1177/1352458520970841,"data/MS_EXPORT/files/28373/Walton et al. - 2020 - Rising prevalence of multiple sclerosis worldwide Insights from the Atlas of MS, third edition.pdf"
Epidemiology of Multiple Sclerosis,10.1016/j.neurol.2015.10.006,data/MS_EXPORT/files/28378/Leray et al. - 2016 - Epidemiology of multiple sclerosis.pdf
